{
  "schema_version": "cuav-diagram/1",
  "diagram_id": "chain-golden-02-dsp",
  "name": "典型链路 · 全合成 · golden-02 宽带 · 三级 DSP 全开",
  "scenario_ref": {
    "scenario_id": "golden-02",
    "sha256": "8e6236d3c2126e2eb347ee06677d7158ad85ad8a4367ca58e3f221569bc5bc82"
  },
  "nodes": [
    {
      "id": "scn",
      "type": "ScenarioSource",
      "scene_binding": {
        "scenario_id": "golden-02",
        "site_id": "site-1"
      },
      "params": {
        "sample_rate_Hz": 10000000,
        "total_samples": 60000000
      }
    },
    {
      "id": "tx__uav-1",
      "type": "SceneEmitterSource",
      "scene_binding": {
        "scenario_id": "golden-02",
        "entity_id": "uav-1"
      },
      "params": {
        "sample_rate_Hz": 10000000,
        "total_samples": 60000000,
        "center_frequency_Hz": 2441000000,
        "emit_at_tx_power": true
      }
    },
    {
      "id": "tx__uav-2",
      "type": "SceneEmitterSource",
      "scene_binding": {
        "scenario_id": "golden-02",
        "entity_id": "uav-2"
      },
      "params": {
        "sample_rate_Hz": 10000000,
        "total_samples": 60000000,
        "center_frequency_Hz": 2441000000,
        "emit_at_tx_power": true
      }
    },
    {
      "id": "tx_ant__uav-1",
      "type": "AntennaGain",
      "params": {
        "role": "tx",
        "gain_dBi": 2
      }
    },
    {
      "id": "ch__uav-1",
      "type": "SceneBoundChannel",
      "scene_binding": {
        "scenario_id": "golden-02",
        "entity_id": "uav-1"
      },
      "params": {
        "gain_mode": "path_loss_only"
      }
    },
    {
      "id": "rx_ant__uav-1",
      "type": "AntennaGain",
      "params": {
        "role": "rx",
        "gain_dBi": 3
      }
    },
    {
      "id": "tx_ant__uav-2",
      "type": "AntennaGain",
      "params": {
        "role": "tx",
        "gain_dBi": 0
      }
    },
    {
      "id": "ch__uav-2",
      "type": "SceneBoundChannel",
      "scene_binding": {
        "scenario_id": "golden-02",
        "entity_id": "uav-2"
      },
      "params": {
        "gain_mode": "path_loss_only"
      }
    },
    {
      "id": "rx_ant__uav-2",
      "type": "AntennaGain",
      "params": {
        "role": "rx",
        "gain_dBi": 3
      }
    },
    {
      "id": "sup",
      "type": "Superposition",
      "params": {}
    },
    {
      "id": "rx_flt",
      "type": "RxFilter",
      "params": {
        "bw_Hz": 8000000
      }
    },
    {
      "id": "rx_fe",
      "type": "ReceiverFrontEnd",
      "params": {
        "nf_dB": 6,
        "gain_dB": 20
      }
    },
    {
      "id": "adc",
      "type": "AdcQuantizer",
      "params": {
        "full_scale_dBm": -20
      }
    },
    {
      "id": "ddc",
      "type": "DDC",
      "params": {
        "f_shift_Hz": -2500000,
        "decim": 2
      }
    },
    {
      "id": "chan",
      "type": "Channelizer",
      "params": {
        "channels": 2,
        "select_channel": 1
      }
    },
    {
      "id": "det",
      "type": "EnergyDetector",
      "scene_binding": {
        "scenario_id": "golden-02",
        "site_id": "site-1"
      },
      "params": {
        "band_lo_Hz": -1125000,
        "band_hi_Hz": 1125000,
        "noise_mode": "sliding"
      }
    },
    {
      "id": "feat",
      "type": "FeatureExtractor",
      "scene_binding": {
        "scenario_id": "golden-02",
        "site_id": "site-1"
      },
      "params": {}
    },
    {
      "id": "rec",
      "type": "TemplateClassifier",
      "scene_binding": {
        "scenario_id": "golden-02",
        "site_id": "site-1"
      },
      "params": {}
    },
    {
      "id": "eval",
      "type": "Evaluator",
      "scene_binding": {
        "scenario_id": "golden-02",
        "site_id": "site-1"
      },
      "params": {}
    }
  ],
  "edges": [
    {
      "id": "e1",
      "from": {
        "node": "tx__uav-1",
        "port": "out"
      },
      "to": {
        "node": "tx_ant__uav-1",
        "port": "in"
      }
    },
    {
      "id": "e2",
      "from": {
        "node": "scn",
        "port": "link:uav-1"
      },
      "to": {
        "node": "tx_ant__uav-1",
        "port": "scene"
      }
    },
    {
      "id": "e3",
      "from": {
        "node": "tx_ant__uav-1",
        "port": "out"
      },
      "to": {
        "node": "ch__uav-1",
        "port": "in"
      }
    },
    {
      "id": "e4",
      "from": {
        "node": "scn",
        "port": "link:uav-1"
      },
      "to": {
        "node": "ch__uav-1",
        "port": "scene"
      }
    },
    {
      "id": "e5",
      "from": {
        "node": "ch__uav-1",
        "port": "out"
      },
      "to": {
        "node": "rx_ant__uav-1",
        "port": "in"
      }
    },
    {
      "id": "e6",
      "from": {
        "node": "scn",
        "port": "link:uav-1"
      },
      "to": {
        "node": "rx_ant__uav-1",
        "port": "scene"
      }
    },
    {
      "id": "e7",
      "from": {
        "node": "tx__uav-2",
        "port": "out"
      },
      "to": {
        "node": "tx_ant__uav-2",
        "port": "in"
      }
    },
    {
      "id": "e8",
      "from": {
        "node": "scn",
        "port": "link:uav-2"
      },
      "to": {
        "node": "tx_ant__uav-2",
        "port": "scene"
      }
    },
    {
      "id": "e9",
      "from": {
        "node": "tx_ant__uav-2",
        "port": "out"
      },
      "to": {
        "node": "ch__uav-2",
        "port": "in"
      }
    },
    {
      "id": "e10",
      "from": {
        "node": "scn",
        "port": "link:uav-2"
      },
      "to": {
        "node": "ch__uav-2",
        "port": "scene"
      }
    },
    {
      "id": "e11",
      "from": {
        "node": "ch__uav-2",
        "port": "out"
      },
      "to": {
        "node": "rx_ant__uav-2",
        "port": "in"
      }
    },
    {
      "id": "e12",
      "from": {
        "node": "scn",
        "port": "link:uav-2"
      },
      "to": {
        "node": "rx_ant__uav-2",
        "port": "scene"
      }
    },
    {
      "id": "e13",
      "from": {
        "node": "rx_ant__uav-1",
        "port": "out"
      },
      "to": {
        "node": "sup",
        "port": "in1"
      }
    },
    {
      "id": "e14",
      "from": {
        "node": "rx_ant__uav-2",
        "port": "out"
      },
      "to": {
        "node": "sup",
        "port": "in2"
      }
    },
    {
      "id": "e15",
      "from": {
        "node": "sup",
        "port": "out"
      },
      "to": {
        "node": "rx_flt",
        "port": "in"
      }
    },
    {
      "id": "e16",
      "from": {
        "node": "rx_flt",
        "port": "out"
      },
      "to": {
        "node": "rx_fe",
        "port": "in"
      }
    },
    {
      "id": "e17",
      "from": {
        "node": "rx_fe",
        "port": "out"
      },
      "to": {
        "node": "adc",
        "port": "in"
      }
    },
    {
      "id": "e18",
      "from": {
        "node": "adc",
        "port": "out"
      },
      "to": {
        "node": "ddc",
        "port": "in"
      }
    },
    {
      "id": "e19",
      "from": {
        "node": "ddc",
        "port": "out"
      },
      "to": {
        "node": "chan",
        "port": "in"
      }
    },
    {
      "id": "e20",
      "from": {
        "node": "chan",
        "port": "out"
      },
      "to": {
        "node": "det",
        "port": "in"
      }
    },
    {
      "id": "e21",
      "from": {
        "node": "chan",
        "port": "out"
      },
      "to": {
        "node": "feat",
        "port": "iq"
      }
    },
    {
      "id": "e22",
      "from": {
        "node": "det",
        "port": "out"
      },
      "to": {
        "node": "feat",
        "port": "det"
      }
    },
    {
      "id": "e23",
      "from": {
        "node": "feat",
        "port": "out"
      },
      "to": {
        "node": "rec",
        "port": "in"
      }
    },
    {
      "id": "e24",
      "from": {
        "node": "det",
        "port": "out"
      },
      "to": {
        "node": "eval",
        "port": "det"
      }
    },
    {
      "id": "e25",
      "from": {
        "node": "rec",
        "port": "out"
      },
      "to": {
        "node": "eval",
        "port": "rec"
      }
    },
    {
      "id": "e26",
      "from": {
        "node": "scn",
        "port": "link:uav-1"
      },
      "to": {
        "node": "eval",
        "port": "scene1"
      }
    },
    {
      "id": "e27",
      "from": {
        "node": "scn",
        "port": "link:uav-2"
      },
      "to": {
        "node": "eval",
        "port": "scene2"
      }
    }
  ],
  "observation_points": [
    {
      "id": "s3",
      "label": "S3 量化后",
      "node": "adc",
      "port": "out",
      "products": [
        "spectrum",
        "envelope"
      ]
    },
    {
      "id": "s4",
      "label": "S4 主产品",
      "node": "ddc",
      "port": "out",
      "products": [
        "spectrum",
        "envelope"
      ]
    },
    {
      "id": "s5",
      "label": "S5 子信道",
      "node": "chan",
      "port": "out",
      "products": [
        "spectrum",
        "envelope"
      ]
    }
  ],
  "run": {
    "seed": 20260915,
    "duration_s": 6,
    "time_basis": "LogicalSim"
  },
  "template_ref": {
    "template_id": "chain-v1",
    "mode": "synthetic",
    "version": 1
  }
}
