{
  "schema_version": "cuav-diagram/1",
  "diagram_id": "chain-gfsk",
  "name": "典型链路 · 全合成 · GFSK 族（FrSky + Futaba S-FHSS 跳频遥控，80 MS/s）",
  "scenario_ref": {
    "scenario_id": "gfsk-80m",
    "sha256": "ec6b38d4028bbd5135d4644cdc976920946a6468e3993e5cf5d2c645e96a9e29"
  },
  "nodes": [
    {
      "id": "scn",
      "type": "ScenarioSource",
      "scene_binding": {
        "scenario_id": "gfsk-80m",
        "site_id": "site-1"
      },
      "params": {
        "sample_rate_Hz": 80000000,
        "total_samples": 80000000
      }
    },
    {
      "id": "tx__rc-frsky",
      "type": "SceneEmitterSource",
      "scene_binding": {
        "scenario_id": "gfsk-80m",
        "entity_id": "rc-frsky"
      },
      "params": {
        "sample_rate_Hz": 80000000,
        "total_samples": 80000000,
        "center_frequency_Hz": 2440000000,
        "emit_at_tx_power": true
      }
    },
    {
      "id": "tx__rc-futaba",
      "type": "SceneEmitterSource",
      "scene_binding": {
        "scenario_id": "gfsk-80m",
        "entity_id": "rc-futaba"
      },
      "params": {
        "sample_rate_Hz": 80000000,
        "total_samples": 80000000,
        "center_frequency_Hz": 2440000000,
        "emit_at_tx_power": true
      }
    },
    {
      "id": "tx_ant__rc-frsky",
      "type": "AntennaGain",
      "params": {
        "role": "tx",
        "gain_dBi": 0
      }
    },
    {
      "id": "ch__rc-frsky",
      "type": "SceneBoundChannel",
      "scene_binding": {
        "scenario_id": "gfsk-80m",
        "entity_id": "rc-frsky"
      },
      "params": {
        "gain_mode": "path_loss_only"
      }
    },
    {
      "id": "rx_ant__rc-frsky",
      "type": "AntennaGain",
      "params": {
        "role": "rx",
        "gain_dBi": 3
      }
    },
    {
      "id": "tx_ant__rc-futaba",
      "type": "AntennaGain",
      "params": {
        "role": "tx",
        "gain_dBi": 0
      }
    },
    {
      "id": "ch__rc-futaba",
      "type": "SceneBoundChannel",
      "scene_binding": {
        "scenario_id": "gfsk-80m",
        "entity_id": "rc-futaba"
      },
      "params": {
        "gain_mode": "path_loss_only"
      }
    },
    {
      "id": "rx_ant__rc-futaba",
      "type": "AntennaGain",
      "params": {
        "role": "rx",
        "gain_dBi": 3
      }
    },
    {
      "id": "sup",
      "type": "Superposition",
      "params": {}
    },
    {
      "id": "rx_fe",
      "type": "ReceiverFrontEnd",
      "params": {
        "nf_dB": 6,
        "gain_dB": 20
      }
    },
    {
      "id": "adc",
      "type": "AdcQuantizer",
      "params": {
        "full_scale_dBm": -20
      }
    },
    {
      "id": "det",
      "type": "EnergyDetector",
      "scene_binding": {
        "scenario_id": "gfsk-80m",
        "site_id": "site-1"
      },
      "params": {
        "band_lo_Hz": -36000000,
        "band_hi_Hz": 36000000,
        "noise_mode": "sliding"
      }
    },
    {
      "id": "feat",
      "type": "FeatureExtractor",
      "scene_binding": {
        "scenario_id": "gfsk-80m",
        "site_id": "site-1"
      },
      "params": {}
    },
    {
      "id": "rec",
      "type": "TemplateClassifier",
      "scene_binding": {
        "scenario_id": "gfsk-80m",
        "site_id": "site-1"
      },
      "params": {}
    },
    {
      "id": "eval",
      "type": "Evaluator",
      "scene_binding": {
        "scenario_id": "gfsk-80m",
        "site_id": "site-1"
      },
      "params": {}
    }
  ],
  "edges": [
    {
      "id": "e1",
      "from": {
        "node": "tx__rc-frsky",
        "port": "out"
      },
      "to": {
        "node": "tx_ant__rc-frsky",
        "port": "in"
      }
    },
    {
      "id": "e2",
      "from": {
        "node": "scn",
        "port": "link:rc-frsky"
      },
      "to": {
        "node": "tx_ant__rc-frsky",
        "port": "scene"
      }
    },
    {
      "id": "e3",
      "from": {
        "node": "tx_ant__rc-frsky",
        "port": "out"
      },
      "to": {
        "node": "ch__rc-frsky",
        "port": "in"
      }
    },
    {
      "id": "e4",
      "from": {
        "node": "scn",
        "port": "link:rc-frsky"
      },
      "to": {
        "node": "ch__rc-frsky",
        "port": "scene"
      }
    },
    {
      "id": "e5",
      "from": {
        "node": "ch__rc-frsky",
        "port": "out"
      },
      "to": {
        "node": "rx_ant__rc-frsky",
        "port": "in"
      }
    },
    {
      "id": "e6",
      "from": {
        "node": "scn",
        "port": "link:rc-frsky"
      },
      "to": {
        "node": "rx_ant__rc-frsky",
        "port": "scene"
      }
    },
    {
      "id": "e7",
      "from": {
        "node": "tx__rc-futaba",
        "port": "out"
      },
      "to": {
        "node": "tx_ant__rc-futaba",
        "port": "in"
      }
    },
    {
      "id": "e8",
      "from": {
        "node": "scn",
        "port": "link:rc-futaba"
      },
      "to": {
        "node": "tx_ant__rc-futaba",
        "port": "scene"
      }
    },
    {
      "id": "e9",
      "from": {
        "node": "tx_ant__rc-futaba",
        "port": "out"
      },
      "to": {
        "node": "ch__rc-futaba",
        "port": "in"
      }
    },
    {
      "id": "e10",
      "from": {
        "node": "scn",
        "port": "link:rc-futaba"
      },
      "to": {
        "node": "ch__rc-futaba",
        "port": "scene"
      }
    },
    {
      "id": "e11",
      "from": {
        "node": "ch__rc-futaba",
        "port": "out"
      },
      "to": {
        "node": "rx_ant__rc-futaba",
        "port": "in"
      }
    },
    {
      "id": "e12",
      "from": {
        "node": "scn",
        "port": "link:rc-futaba"
      },
      "to": {
        "node": "rx_ant__rc-futaba",
        "port": "scene"
      }
    },
    {
      "id": "e13",
      "from": {
        "node": "rx_ant__rc-frsky",
        "port": "out"
      },
      "to": {
        "node": "sup",
        "port": "in1"
      }
    },
    {
      "id": "e14",
      "from": {
        "node": "rx_ant__rc-futaba",
        "port": "out"
      },
      "to": {
        "node": "sup",
        "port": "in2"
      }
    },
    {
      "id": "e15",
      "from": {
        "node": "sup",
        "port": "out"
      },
      "to": {
        "node": "rx_fe",
        "port": "in"
      }
    },
    {
      "id": "e16",
      "from": {
        "node": "rx_fe",
        "port": "out"
      },
      "to": {
        "node": "adc",
        "port": "in"
      }
    },
    {
      "id": "e17",
      "from": {
        "node": "adc",
        "port": "out"
      },
      "to": {
        "node": "det",
        "port": "in"
      }
    },
    {
      "id": "e18",
      "from": {
        "node": "adc",
        "port": "out"
      },
      "to": {
        "node": "feat",
        "port": "iq"
      }
    },
    {
      "id": "e19",
      "from": {
        "node": "det",
        "port": "out"
      },
      "to": {
        "node": "feat",
        "port": "det"
      }
    },
    {
      "id": "e20",
      "from": {
        "node": "feat",
        "port": "out"
      },
      "to": {
        "node": "rec",
        "port": "in"
      }
    },
    {
      "id": "e21",
      "from": {
        "node": "det",
        "port": "out"
      },
      "to": {
        "node": "eval",
        "port": "det"
      }
    },
    {
      "id": "e22",
      "from": {
        "node": "rec",
        "port": "out"
      },
      "to": {
        "node": "eval",
        "port": "rec"
      }
    },
    {
      "id": "e23",
      "from": {
        "node": "scn",
        "port": "link:rc-frsky"
      },
      "to": {
        "node": "eval",
        "port": "scene1"
      }
    },
    {
      "id": "e24",
      "from": {
        "node": "scn",
        "port": "link:rc-futaba"
      },
      "to": {
        "node": "eval",
        "port": "scene2"
      }
    }
  ],
  "observation_points": [
    {
      "id": "s0__rc-frsky",
      "label": "S0 辐射源输出 · rc-frsky",
      "node": "tx__rc-frsky",
      "port": "out",
      "products": [
        "spectrum",
        "envelope"
      ]
    },
    {
      "id": "s0__rc-futaba",
      "label": "S0 辐射源输出 · rc-futaba",
      "node": "tx__rc-futaba",
      "port": "out",
      "products": [
        "spectrum",
        "envelope"
      ]
    },
    {
      "id": "s3",
      "label": "S3 量化后",
      "node": "adc",
      "port": "out",
      "products": [
        "spectrum",
        "envelope"
      ]
    }
  ],
  "run": {
    "seed": 20260929,
    "duration_s": 1,
    "time_basis": "LogicalSim"
  },
  "template_ref": {
    "template_id": "chain-v1",
    "mode": "synthetic",
    "version": 1
  }
}
