{
  "schema_version": "cuav-diagram/1",
  "diagram_id": "chain-mixed",
  "name": "典型链路 · 混合增强（标准算例回归）",
  "scenario_ref": {
    "scenario_id": "mixed-wideband",
    "sha256": "3a127f735cc96a098f64c164bfcc488a56d8b99754e6aa6663f91a29eb5df1c7"
  },
  "nodes": [
    {
      "id": "scn",
      "type": "ScenarioSource",
      "scene_binding": {
        "scenario_id": "mixed-wideband",
        "site_id": "site-1"
      },
      "params": {
        "sample_rate_Hz": 80000000,
        "total_samples": 4000000
      }
    },
    {
      "id": "tx",
      "type": "SceneEmitterSource",
      "scene_binding": {
        "scenario_id": "mixed-wideband",
        "entity_id": "uav-1"
      },
      "params": {
        "sample_rate_Hz": 80000000,
        "total_samples": 4000000,
        "center_frequency_Hz": 2440000000,
        "emit_at_tx_power": true
      }
    },
    {
      "id": "tx_ant",
      "type": "AntennaGain",
      "params": {
        "role": "tx",
        "gain_dBi": 2
      }
    },
    {
      "id": "ch",
      "type": "SceneBoundChannel",
      "scene_binding": {
        "scenario_id": "mixed-wideband",
        "entity_id": "uav-1"
      },
      "params": {
        "gain_mode": "path_loss_only"
      }
    },
    {
      "id": "rx_ant",
      "type": "AntennaGain",
      "params": {
        "role": "rx",
        "gain_dBi": 3
      }
    },
    {
      "id": "rx_fe",
      "type": "ReceiverFrontEnd",
      "params": {
        "nf_dB": 6
      }
    },
    {
      "id": "adc",
      "type": "AdcQuantizer",
      "params": {
        "full_scale_dBm": -20
      }
    },
    {
      "id": "bg",
      "type": "FileReplaySource",
      "params": {
        "data_id": "dronerfb_0_CH0_S4"
      }
    },
    {
      "id": "mix",
      "type": "AddMixer",
      "params": {}
    },
    {
      "id": "det",
      "type": "EnergyDetector",
      "scene_binding": {
        "scenario_id": "mixed-wideband",
        "site_id": "site-1"
      },
      "params": {
        "band_lo_Hz": -36000000,
        "band_hi_Hz": 36000000,
        "noise_mode": "sliding"
      }
    },
    {
      "id": "feat",
      "type": "FeatureExtractor",
      "scene_binding": {
        "scenario_id": "mixed-wideband",
        "site_id": "site-1"
      },
      "params": {}
    },
    {
      "id": "rec",
      "type": "TemplateClassifier",
      "scene_binding": {
        "scenario_id": "mixed-wideband",
        "site_id": "site-1"
      },
      "params": {}
    },
    {
      "id": "eval",
      "type": "Evaluator",
      "scene_binding": {
        "scenario_id": "mixed-wideband",
        "site_id": "site-1"
      },
      "params": {
        "data_id": "dronerfb_0_CH0_S4"
      }
    }
  ],
  "edges": [
    {
      "id": "e1",
      "from": {
        "node": "tx",
        "port": "out"
      },
      "to": {
        "node": "tx_ant",
        "port": "in"
      }
    },
    {
      "id": "e2",
      "from": {
        "node": "scn",
        "port": "link:uav-1"
      },
      "to": {
        "node": "tx_ant",
        "port": "scene"
      }
    },
    {
      "id": "e3",
      "from": {
        "node": "tx_ant",
        "port": "out"
      },
      "to": {
        "node": "ch",
        "port": "in"
      }
    },
    {
      "id": "e4",
      "from": {
        "node": "scn",
        "port": "link:uav-1"
      },
      "to": {
        "node": "ch",
        "port": "scene"
      }
    },
    {
      "id": "e5",
      "from": {
        "node": "ch",
        "port": "out"
      },
      "to": {
        "node": "rx_ant",
        "port": "in"
      }
    },
    {
      "id": "e6",
      "from": {
        "node": "scn",
        "port": "link:uav-1"
      },
      "to": {
        "node": "rx_ant",
        "port": "scene"
      }
    },
    {
      "id": "e7",
      "from": {
        "node": "rx_ant",
        "port": "out"
      },
      "to": {
        "node": "rx_fe",
        "port": "in"
      }
    },
    {
      "id": "e8",
      "from": {
        "node": "rx_fe",
        "port": "out"
      },
      "to": {
        "node": "adc",
        "port": "in"
      }
    },
    {
      "id": "e9",
      "from": {
        "node": "adc",
        "port": "out"
      },
      "to": {
        "node": "mix",
        "port": "a"
      }
    },
    {
      "id": "e10",
      "from": {
        "node": "bg",
        "port": "out"
      },
      "to": {
        "node": "mix",
        "port": "b"
      }
    },
    {
      "id": "e11",
      "from": {
        "node": "mix",
        "port": "out"
      },
      "to": {
        "node": "det",
        "port": "in"
      }
    },
    {
      "id": "e12",
      "from": {
        "node": "mix",
        "port": "out"
      },
      "to": {
        "node": "feat",
        "port": "iq"
      }
    },
    {
      "id": "e13",
      "from": {
        "node": "det",
        "port": "out"
      },
      "to": {
        "node": "feat",
        "port": "det"
      }
    },
    {
      "id": "e14",
      "from": {
        "node": "feat",
        "port": "out"
      },
      "to": {
        "node": "rec",
        "port": "in"
      }
    },
    {
      "id": "e15",
      "from": {
        "node": "det",
        "port": "out"
      },
      "to": {
        "node": "eval",
        "port": "det"
      }
    },
    {
      "id": "e16",
      "from": {
        "node": "rec",
        "port": "out"
      },
      "to": {
        "node": "eval",
        "port": "rec"
      }
    },
    {
      "id": "e17",
      "from": {
        "node": "scn",
        "port": "link:uav-1"
      },
      "to": {
        "node": "eval",
        "port": "scene1"
      }
    }
  ],
  "observation_points": [
    {
      "id": "s4",
      "label": "S4 主产品",
      "node": "mix",
      "port": "out",
      "products": [
        "spectrum",
        "envelope"
      ]
    }
  ],
  "run": {
    "seed": 20260917,
    "duration_s": 0.05,
    "time_basis": "LogicalSim"
  },
  "template_ref": {
    "template_id": "chain-v1",
    "mode": "mixed",
    "version": 1
  }
}
